{
  "$schema": "../schemas/concept_entity.schema.json",
  "id": "yang_metal_symbolism",
  "category": "symbolic",
  "title": "Kim dương — cắt rời kỷ luật",
  "summary": "Kim dương biểu thị lực cắt, kỷ luật và chuyển hóa bằng quyết đoạn.",
  "meaning": "Tính chất kim dương: cắt, chỉnh, kỷ luật, đổi hình bằng lực quyết. Khác kim âm ở chỗ dụng cụ là rìu/kiếm chứ không phải kim/ngọc.",
  "conditions": [
    "Áp dụng khi cần giải thích chức năng kim dương",
    "Khi bị chọn làm Kỵ thần, cùng chức năng cắt trở thành rủi ro mất cân",
    "Vai trò Dụng / Hỷ / Kỵ do Decision Explanation gán"
  ],
  "applications": {
    "useful_god": "Khi làm Dụng thần, cắt phần thừa và lập kỷ luật cần thiết.",
    "hy": "Khi thuộc Hỷ thần, hỗ trợ quyết đoạn theo hướng Dụng.",
    "ky": "Khi thuộc Kỵ thần, dễ thành khắc nghiệt, phá hủy hoặc cứng lạnh."
  },
  "related_concepts": [
    { "target_id": "control_excess", "relationship": "supports" },
    { "target_id": "drain_strong_day_master", "relationship": "related_to" }
  ],
  "related_entities": [
    { "domain": "UsefulGod", "key": "Canh" }
  ],
  "metadata": {
    "author": "BTE Knowledge Team",
    "version": "1.0.0",
    "created": "2026-08-15",
    "updated": "2026-08-15",
    "status": "approved",
    "source": "knowledge/interpretation/concepts/symbolic/yang_metal_symbolism.json",
    "quality": "k2_production"
  }
}
